document_identifier,document_title,document_title_en,document_type,document_parliamentary_term,document_date,document_public_register_notation,document_creator_person,document_creator_organization,document_language,document_pdf,document_doc,document_answers_pdf,document_answers_doc,document_annexes_pdf,document_annexes_doc,document_ep_number,document_URI
E-9-2024-000697,Status of State aid authorisation procedures for industrial and energy projects in eastern Germany,Status of State aid authorisation procedures for industrial and energy projects in eastern Germany,Written question,9,2024-03-05,,Cornelia ERNST,,English,https://data.europarl.europa.eu/distribution/reds_iMaQp/E-9-2024-000697/E-9-2024-000697_en.pdf,https://data.europarl.europa.eu/distribution/reds_iMaQp/E-9-2024-000697/E-9-2024-000697_en.docx,https://data.europarl.europa.eu/distribution/reds_iMaQp_Asw/E-9-2024-000697-ASW/E-9-2024-000697-ASW-FF_en.pdf,https://data.europarl.europa.eu/distribution/reds_iMaQp_Asw/E-9-2024-000697-ASW/E-9-2024-000697-ASW_en.docx,,,PE760.594,https://data.europarl.europa.eu/eli/dl/doc/E-9-2024-000697
E-9-2024-000647,"Does the European Union truly want to combat money laundering, corruption and the financing of terrorism?","Does the European Union truly want to combat money laundering, corruption and the financing of terrorism?",Written question,9,2024-02-28,,Jean-Paul GARRAUD,,English,https://data.europarl.europa.eu/distribution/reds_iMaQp/E-9-2024-000647/E-9-2024-000647_en.pdf,https://data.europarl.europa.eu/distribution/reds_iMaQp/E-9-2024-000647/E-9-2024-000647_en.docx,https://data.europarl.europa.eu/distribution/reds_iMaQp_Asw/E-9-2024-000647-ASW/E-9-2024-000647-ASW_en.pdf,https://data.europarl.europa.eu/distribution/reds_iMaQp_Asw/E-9-2024-000647-ASW/E-9-2024-000647-ASW_en.docx,,,PE760.330,https://data.europarl.europa.eu/eli/dl/doc/E-9-2024-000647
E-9-2024-000665,New rare earth mining project in Castile-La Mancha,New rare earth mining project in Castile-La Mancha,Written question,9,2024-02-29,,Idoia VILLANUEVA RUIZ,,English,https://data.europarl.europa.eu/distribution/reds_iMaQp/E-9-2024-000665/E-9-2024-000665_en.pdf,https://data.europarl.europa.eu/distribution/reds_iMaQp/E-9-2024-000665/E-9-2024-000665_en.docx,https://data.europarl.europa.eu/distribution/reds_iMaQp_Asw/E-9-2024-000665-ASW/E-9-2024-000665-ASW_en.pdf,https://data.europarl.europa.eu/distribution/reds_iMaQp_Asw/E-9-2024-000665-ASW/E-9-2024-000665-ASW_en.docx,,,PE760.298,https://data.europarl.europa.eu/eli/dl/doc/E-9-2024-000665
E-9-2024-000659,Wind farm projects and environmental protection in Sardinia’s Gallura region,Wind farm projects and environmental protection in Sardinia’s Gallura region,Written question,9,2024-02-28,,Ignazio CORRAO,,English,https://data.europarl.europa.eu/distribution/reds_iMaQp/E-9-2024-000659/E-9-2024-000659_en.pdf,https://data.europarl.europa.eu/distribution/reds_iMaQp/E-9-2024-000659/E-9-2024-000659_en.docx,https://data.europarl.europa.eu/distribution/reds_iMaQp_Asw/E-9-2024-000659-ASW/E-9-2024-000659-ASW_en.pdf,https://data.europarl.europa.eu/distribution/reds_iMaQp_Asw/E-9-2024-000659-ASW/E-9-2024-000659-ASW_en.docx,,,PE760.292,https://data.europarl.europa.eu/eli/dl/doc/E-9-2024-000659
E-9-2024-000700,Activation of the European Union Solidarity Fund for the damage wrought by bad weather in Veneto,Activation of the European Union Solidarity Fund for the damage wrought by bad weather in Veneto,Written question,9,2024-03-06,,Gianantonio DA RE,,English,https://data.europarl.europa.eu/distribution/reds_iMaQp/E-9-2024-000700/E-9-2024-000700_en.pdf,https://data.europarl.europa.eu/distribution/reds_iMaQp/E-9-2024-000700/E-9-2024-000700_en.docx,https://data.europarl.europa.eu/distribution/reds_iMaQp_Asw/E-9-2024-000700-ASW/E-9-2024-000700-ASW_en.pdf,https://data.europarl.europa.eu/distribution/reds_iMaQp_Asw/E-9-2024-000700-ASW/E-9-2024-000700-ASW_en.docx,,,PE760.547,https://data.europarl.europa.eu/eli/dl/doc/E-9-2024-000700
E-9-2024-000703,Local waste treatment in French Polynesia,Local waste treatment in French Polynesia,Written question,9,2024-03-06,,André ROUGÉ,,English,https://data.europarl.europa.eu/distribution/reds_iMaQp/E-9-2024-000703/E-9-2024-000703_en.pdf,https://data.europarl.europa.eu/distribution/reds_iMaQp/E-9-2024-000703/E-9-2024-000703_en.docx,https://data.europarl.europa.eu/distribution/reds_iMaQp_Asw/E-9-2024-000703-ASW/E-9-2024-000703-ASW_en.pdf,https://data.europarl.europa.eu/distribution/reds_iMaQp_Asw/E-9-2024-000703-ASW/E-9-2024-000703-ASW_en.docx,,,PE760.550,https://data.europarl.europa.eu/eli/dl/doc/E-9-2024-000703
E-9-2024-000689,Azerbaijan plans new aggression with Türkiye’s blessing,Azerbaijan plans new aggression with Türkiye’s blessing,Written question,9,2024-03-04,,Loucas FOURLAS,,English,https://data.europarl.europa.eu/distribution/reds_iMaQp/E-9-2024-000689/E-9-2024-000689_en.pdf,https://data.europarl.europa.eu/distribution/reds_iMaQp/E-9-2024-000689/E-9-2024-000689_en.docx,https://data.europarl.europa.eu/distribution/reds_iMaQp_Asw/E-9-2024-000689-ASW/E-9-2024-000689-ASW_en.pdf,https://data.europarl.europa.eu/distribution/reds_iMaQp_Asw/E-9-2024-000689-ASW/E-9-2024-000689-ASW_en.docx,,,PE760.102,https://data.europarl.europa.eu/eli/dl/doc/E-9-2024-000689
E-9-2024-000742,Pro-Russian separatists in Transnistria,Pro-Russian separatists in Transnistria,Written question,9,2024-03-07,,Hilde VAUTMANS,,English,https://data.europarl.europa.eu/distribution/reds_iMaQp/E-9-2024-000742/E-9-2024-000742_en.pdf,https://data.europarl.europa.eu/distribution/reds_iMaQp/E-9-2024-000742/E-9-2024-000742_en.docx,https://data.europarl.europa.eu/distribution/reds_iMaQp_Asw/E-9-2024-000742-ASW/E-9-2024-000742-ASW_en.pdf,https://data.europarl.europa.eu/distribution/reds_iMaQp_Asw/E-9-2024-000742-ASW/E-9-2024-000742-ASW_en.docx,,,PE760.105,https://data.europarl.europa.eu/eli/dl/doc/E-9-2024-000742
E-9-2024-000748,"Delayed start to the construction of the semiconductor factory in Ensdorf, Saarland","Delayed start to the construction of the semiconductor factory in Ensdorf, Saarland",Written question,9,2024-03-08,,Jan-Christoph OETJEN,,English,https://data.europarl.europa.eu/distribution/reds_iMaQp/E-9-2024-000748/E-9-2024-000748_en.pdf,https://data.europarl.europa.eu/distribution/reds_iMaQp/E-9-2024-000748/E-9-2024-000748_en.docx,https://data.europarl.europa.eu/distribution/reds_iMaQp_Asw/E-9-2024-000748-ASW/E-9-2024-000748-ASW_en.pdf,https://data.europarl.europa.eu/distribution/reds_iMaQp_Asw/E-9-2024-000748-ASW/E-9-2024-000748-ASW_en.docx,,,PE760.706,https://data.europarl.europa.eu/eli/dl/doc/E-9-2024-000748
E-9-2024-000682,Beam trawling in Natura 2000 areas,Beam trawling in Natura 2000 areas,Written question,9,2024-03-01,,Nikolaj VILLUMSEN,,English,https://data.europarl.europa.eu/distribution/reds_iMaQp/E-9-2024-000682/E-9-2024-000682_en.pdf,https://data.europarl.europa.eu/distribution/reds_iMaQp/E-9-2024-000682/E-9-2024-000682_en.docx,https://data.europarl.europa.eu/distribution/reds_iMaQp_Asw/E-9-2024-000682-ASW/E-9-2024-000682-ASW_en.pdf,https://data.europarl.europa.eu/distribution/reds_iMaQp_Asw/E-9-2024-000682-ASW/E-9-2024-000682-ASW_en.docx,,,PE760.308,https://data.europarl.europa.eu/eli/dl/doc/E-9-2024-000682
E-9-2024-000728,Right to a defence – violations regarding access to a lawyer,Right to a defence – violations regarding access to a lawyer,Written question,9,2024-03-07,,Eva KAILI,,English,https://data.europarl.europa.eu/distribution/reds_iMaQp/E-9-2024-000728/E-9-2024-000728_en.pdf,https://data.europarl.europa.eu/distribution/reds_iMaQp/E-9-2024-000728/E-9-2024-000728_en.docx,https://data.europarl.europa.eu/distribution/reds_iMaQp_Asw/E-9-2024-000728-ASW/E-9-2024-000728-ASW_en.pdf,https://data.europarl.europa.eu/distribution/reds_iMaQp_Asw/E-9-2024-000728-ASW/E-9-2024-000728-ASW_en.docx,,,PE760.575,https://data.europarl.europa.eu/eli/dl/doc/E-9-2024-000728
E-9-2024-000650,Lifting of protection for Borsacchio regional reserve,Lifting of protection for Borsacchio regional reserve,Written question,9,2024-02-28,,Rosa D'AMATO,,English,https://data.europarl.europa.eu/distribution/reds_iMaQp/E-9-2024-000650/E-9-2024-000650_en.pdf,https://data.europarl.europa.eu/distribution/reds_iMaQp/E-9-2024-000650/E-9-2024-000650_en.docx,https://data.europarl.europa.eu/distribution/reds_iMaQp_Asw/E-9-2024-000650-ASW/E-9-2024-000650-ASW_en.pdf,https://data.europarl.europa.eu/distribution/reds_iMaQp_Asw/E-9-2024-000650-ASW/E-9-2024-000650-ASW_en.docx,,,PE760.283,https://data.europarl.europa.eu/eli/dl/doc/E-9-2024-000650
E-9-2024-000660,Request for clarification and action concerning competitive distortions in the ground handling market at Palermo and Catania airports,Request for clarification and action concerning competitive distortions in the ground handling market at Palermo and Catania airports,Written question,9,2024-02-28,,Ignazio CORRAO,,English,https://data.europarl.europa.eu/distribution/reds_iMaQp/E-9-2024-000660/E-9-2024-000660_en.pdf,https://data.europarl.europa.eu/distribution/reds_iMaQp/E-9-2024-000660/E-9-2024-000660_en.docx,https://data.europarl.europa.eu/distribution/reds_iMaQp_Asw/E-9-2024-000660-ASW/E-9-2024-000660-ASW-FF_en.pdf,https://data.europarl.europa.eu/distribution/reds_iMaQp_Asw/E-9-2024-000660-ASW/E-9-2024-000660-ASW_en.docx,,,PE760.293,https://data.europarl.europa.eu/eli/dl/doc/E-9-2024-000660
E-9-2024-000653,Review and investigation into how EU funding is allocated and used in agriculture,Review and investigation into how EU funding is allocated and used in agriculture,Written question,9,2024-02-28,,Isabella ADINOLFI,,English,https://data.europarl.europa.eu/distribution/reds_iMaQp/E-9-2024-000653/E-9-2024-000653_en.pdf,https://data.europarl.europa.eu/distribution/reds_iMaQp/E-9-2024-000653/E-9-2024-000653_en.docx,https://data.europarl.europa.eu/distribution/reds_iMaQp_Asw/E-9-2024-000653-ASW/E-9-2024-000653-ASW_en.pdf,https://data.europarl.europa.eu/distribution/reds_iMaQp_Asw/E-9-2024-000653-ASW/E-9-2024-000653-ASW_en.docx,,,PE760.286,https://data.europarl.europa.eu/eli/dl/doc/E-9-2024-000653
E-9-2024-000745,Pancreatic cancer,Pancreatic cancer,Written question,9,2024-03-08,,Adam JARUBAS,,English,https://data.europarl.europa.eu/distribution/reds_iMaQp/E-9-2024-000745/E-9-2024-000745_en.pdf,https://data.europarl.europa.eu/distribution/reds_iMaQp/E-9-2024-000745/E-9-2024-000745_en.docx,https://data.europarl.europa.eu/distribution/reds_iMaQp_Asw/E-9-2024-000745-ASW/E-9-2024-000745-ASW-FF_en.pdf,https://data.europarl.europa.eu/distribution/reds_iMaQp_Asw/E-9-2024-000745-ASW/E-9-2024-000745-ASW_en.docx,,,PE760.703,https://data.europarl.europa.eu/eli/dl/doc/E-9-2024-000745
E-9-2024-000757,"Barriers to equitable access to water and sanitation systems in the EU, starting with the high costs in Alba County","Barriers to equitable access to water and sanitation systems in the EU, starting with the high costs in Alba County",Written question,9,2024-03-11,,Victor NEGRESCU,,English,https://data.europarl.europa.eu/distribution/reds_iMaQp/E-9-2024-000757/E-9-2024-000757_en.pdf,https://data.europarl.europa.eu/distribution/reds_iMaQp/E-9-2024-000757/E-9-2024-000757_en.docx,,,,,PE760.715,https://data.europarl.europa.eu/eli/dl/doc/E-9-2024-000757
E-9-2024-000761,Placing on the market of single-use plastic products and the derogation in Italy for ‘biodegradable and compostable’ plastic products,Placing on the market of single-use plastic products and the derogation in Italy for ‘biodegradable and compostable’ plastic products,Written question,9,2024-03-12,,Matteo GAZZINI,,English,https://data.europarl.europa.eu/distribution/reds_iMaQp/E-9-2024-000761/E-9-2024-000761_en.pdf,https://data.europarl.europa.eu/distribution/reds_iMaQp/E-9-2024-000761/E-9-2024-000761_en.docx,,,,,PE760.719,https://data.europarl.europa.eu/eli/dl/doc/E-9-2024-000761
E-9-2024-000655,Law enforcement cooperation between China and Hungary,Law enforcement cooperation between China and Hungary,Written question,9,2024-02-28,,Sophia IN 'T VELD,,English,https://data.europarl.europa.eu/distribution/reds_iMaQp/E-9-2024-000655/E-9-2024-000655_en.pdf,https://data.europarl.europa.eu/distribution/reds_iMaQp/E-9-2024-000655/E-9-2024-000655_en.docx,,,,,PE760.288,https://data.europarl.europa.eu/eli/dl/doc/E-9-2024-000655
E-9-2024-000710,Urgent need to take action for the liberation of Vladimir Kara-Murza,Urgent need to take action for the liberation of Vladimir Kara-Murza,Written question,9,2024-03-06,,Anja HAGA; Markéta GREGOROVÁ; Klára DOBREV; Jan-Christoph OETJEN; Michael GAHLER; Sven MIKSER; Fabio Massimo CASTALDO; Aurore LALUCQ; Hilde VAUTMANS; Karin KARLSBRO; Pina PICIERNO; Antonio LÓPEZ-ISTÚRIZ WHITE; Inese VAIDERE; Andrus ANSIP; Ivan ŠTEFANEC; Dorien ROOKMAKER; Rasa JUKNEVIČIENĖ; Juozas OLEKAS; Guy VERHOFSTADT; Witold Jan WASZCZYKOWSKI; Bernard GUETTA; Karen MELCHIOR; Andrius KUBILIUS; Raphaël GLUCKSMANN; Olivier CHASTEL; Aušra SEIBUTYTĖ; Brando BENIFEI; Andrey KOVATCHEV; Petras AUŠTREVIČIUS; Francisco GUERREIRO; Attila ARA-KOVÁCS,,English,https://data.europarl.europa.eu/distribution/reds_iMaQp/E-9-2024-000710/E-9-2024-000710_en.pdf,https://data.europarl.europa.eu/distribution/reds_iMaQp/E-9-2024-000710/E-9-2024-000710_en.docx,,,,,PE760.557,https://data.europarl.europa.eu/eli/dl/doc/E-9-2024-000710
E-9-2024-000696,Marina of Fiumicino Isola Sacra,Marina of Fiumicino Isola Sacra,Written question,9,2024-03-05,,Massimiliano SMERIGLIO,,English,https://data.europarl.europa.eu/distribution/reds_iMaQp/E-9-2024-000696/E-9-2024-000696_en.pdf,https://data.europarl.europa.eu/distribution/reds_iMaQp/E-9-2024-000696/E-9-2024-000696_en.docx,,,,,PE760.593,https://data.europarl.europa.eu/eli/dl/doc/E-9-2024-000696
E-9-2024-000719,Gas extraction under the Wadden Sea,Gas extraction under the Wadden Sea,Written question,9,2024-03-06,,Anja HAGA,,English,https://data.europarl.europa.eu/distribution/reds_iMaQp/E-9-2024-000719/E-9-2024-000719_en.pdf,https://data.europarl.europa.eu/distribution/reds_iMaQp/E-9-2024-000719/E-9-2024-000719_en.docx,,,,,PE760.566,https://data.europarl.europa.eu/eli/dl/doc/E-9-2024-000719
E-9-2024-000767,EU-wide recognition of electrosensitivity as a disability,EU-wide recognition of electrosensitivity as a disability,Written question,9,2024-03-12,,Sergio BERLATO,,English,https://data.europarl.europa.eu/distribution/reds_iMaQp/E-9-2024-000767/E-9-2024-000767_en.pdf,https://data.europarl.europa.eu/distribution/reds_iMaQp/E-9-2024-000767/E-9-2024-000767_en.docx,,,,,PE760.725,https://data.europarl.europa.eu/eli/dl/doc/E-9-2024-000767
E-9-2024-000756,An answer to the misuse of nitrous oxide as an intoxicant and the detrimental impact of nitrous oxide canisters on waste treatment facilities,An answer to the misuse of nitrous oxide as an intoxicant and the detrimental impact of nitrous oxide canisters on waste treatment facilities,Written question,9,2024-03-11,,Sara MATTHIEU,,English,https://data.europarl.europa.eu/distribution/reds_iMaQp/E-9-2024-000756/E-9-2024-000756_en.pdf,https://data.europarl.europa.eu/distribution/reds_iMaQp/E-9-2024-000756/E-9-2024-000756_en.docx,,,,,PE760.714,https://data.europarl.europa.eu/eli/dl/doc/E-9-2024-000756
E-9-2024-000747,"Systematic human rights violations in Iran, with a focus on the plight of women: a call to step up EU diplomatic engagement and support regime change","Systematic human rights violations in Iran, with a focus on the plight of women: a call to step up EU diplomatic engagement and support regime change",Written question,9,2024-03-08,,Maria Angela DANZÌ; Pietro BARTOLO; Lucia VUOLO; Stefania ZAMBELLI; Gianna GANCIA,,English,https://data.europarl.europa.eu/distribution/reds_iMaQp/E-9-2024-000747/E-9-2024-000747_en.pdf,https://data.europarl.europa.eu/distribution/reds_iMaQp/E-9-2024-000747/E-9-2024-000747_en.docx,,,,,PE760.705,https://data.europarl.europa.eu/eli/dl/doc/E-9-2024-000747
E-9-2024-000764,Improving the treatment of mixed household waste,Improving the treatment of mixed household waste,Written question,9,2024-03-12,,Aurélia BEIGNEUX,,English,https://data.europarl.europa.eu/distribution/reds_iMaQp/E-9-2024-000764/E-9-2024-000764_en.pdf,https://data.europarl.europa.eu/distribution/reds_iMaQp/E-9-2024-000764/E-9-2024-000764_en.docx,,,,,PE760.722,https://data.europarl.europa.eu/eli/dl/doc/E-9-2024-000764
E-9-2024-000718,Citizenship for Belarusians in exile,Citizenship for Belarusians in exile,Written question,9,2024-03-06,,Janina OCHOJSKA,,English,https://data.europarl.europa.eu/distribution/reds_iMaQp/E-9-2024-000718/E-9-2024-000718_en.pdf,https://data.europarl.europa.eu/distribution/reds_iMaQp/E-9-2024-000718/E-9-2024-000718_en.docx,,,,,PE760.565,https://data.europarl.europa.eu/eli/dl/doc/E-9-2024-000718
E-9-2024-000713,Health warning concerning the presence of Hepatitis A in strawberries from Morocco,Health warning concerning the presence of Hepatitis A in strawberries from Morocco,Written question,9,2024-03-06,,Clara AGUILERA,,English,https://data.europarl.europa.eu/distribution/reds_iMaQp/E-9-2024-000713/E-9-2024-000713_en.pdf,https://data.europarl.europa.eu/distribution/reds_iMaQp/E-9-2024-000713/E-9-2024-000713_en.docx,,,,,PE760.560,https://data.europarl.europa.eu/eli/dl/doc/E-9-2024-000713
E-9-2024-000692,Review of the Web Accessibility Directive,Review of the Web Accessibility Directive,Written question,9,2024-03-05,,Josef MIHÁL,,English,https://data.europarl.europa.eu/distribution/reds_iMaQp/E-9-2024-000692/E-9-2024-000692_en.pdf,https://data.europarl.europa.eu/distribution/reds_iMaQp/E-9-2024-000692/E-9-2024-000692_en.docx,,,,,PE760.589,https://data.europarl.europa.eu/eli/dl/doc/E-9-2024-000692
E-9-2024-000760,Urgent need to extend the Temporary Protection Directive for Ukrainian refugees fleeing the Russian invasion,Urgent need to extend the Temporary Protection Directive for Ukrainian refugees fleeing the Russian invasion,Written question,9,2024-03-12,,Fabio Massimo CASTALDO; Karin KARLSBRO; Andrus ANSIP; María Soraya RODRÍGUEZ RAMOS; Bernard GUETTA; Karen MELCHIOR; Javier NART,,English,https://data.europarl.europa.eu/distribution/reds_iMaQp/E-9-2024-000760/E-9-2024-000760_en.pdf,https://data.europarl.europa.eu/distribution/reds_iMaQp/E-9-2024-000760/E-9-2024-000760_en.docx,,,,,PE760.718,https://data.europarl.europa.eu/eli/dl/doc/E-9-2024-000760
E-9-2024-000702,Digital Markets Act compliance and changes to search results leading to an imbalance in traffic between market players,Digital Markets Act compliance and changes to search results leading to an imbalance in traffic between market players,Written question,9,2024-03-06,,Tsvetelina PENKOVA; Petar VITANOV,,English,https://data.europarl.europa.eu/distribution/reds_iMaQp/E-9-2024-000702/E-9-2024-000702_en.pdf,https://data.europarl.europa.eu/distribution/reds_iMaQp/E-9-2024-000702/E-9-2024-000702_en.docx,,,,,PE760.549,https://data.europarl.europa.eu/eli/dl/doc/E-9-2024-000702
E-9-2024-000717,Study on intersex people in the EU,Study on intersex people in the EU,Written question,9,2024-03-06,,Malin BJÖRK; Marc ANGEL,,English,https://data.europarl.europa.eu/distribution/reds_iMaQp/E-9-2024-000717/E-9-2024-000717_en.pdf,https://data.europarl.europa.eu/distribution/reds_iMaQp/E-9-2024-000717/E-9-2024-000717_en.docx,,,,,PE760.564,https://data.europarl.europa.eu/eli/dl/doc/E-9-2024-000717
E-9-2024-000686,Sexual rights of people with disabilities in Europe,Sexual rights of people with disabilities in Europe,Written question,9,2024-03-04,,Angelo CIOCCA,,English,https://data.europarl.europa.eu/distribution/reds_iMaQp/E-9-2024-000686/E-9-2024-000686_en.pdf,https://data.europarl.europa.eu/distribution/reds_iMaQp/E-9-2024-000686/E-9-2024-000686_en.docx,,,,,PE760.312,https://data.europarl.europa.eu/eli/dl/doc/E-9-2024-000686
E-9-2024-000704,Support for Evros wildfire victims,Support for Evros wildfire victims,Written question,9,2024-03-06,,Emmanouil FRAGKOS,,English,,https://data.europarl.europa.eu/distribution/reds_iMaQp/E-9-2024-000704/E-9-2024-000704_en.docx,,,,,PE760.551,https://data.europarl.europa.eu/eli/dl/doc/E-9-2024-000704
E-9-2024-000716,Health warning concerning the presence of Hepatitis A in strawberries from Morocco,Health warning concerning the presence of Hepatitis A in strawberries from Morocco,Written question,9,2024-03-06,,Juan Ignacio ZOIDO ÁLVAREZ; Dolors MONTSERRAT,,English,https://data.europarl.europa.eu/distribution/reds_iMaQp/E-9-2024-000716/E-9-2024-000716_en.pdf,https://data.europarl.europa.eu/distribution/reds_iMaQp/E-9-2024-000716/E-9-2024-000716_en.docx,,,,,PE760.563,https://data.europarl.europa.eu/eli/dl/doc/E-9-2024-000716
E-9-2024-000759,Atrocities committed by African Parks rangers against the Baka in the EU-funded Odzala-Kokoua National Park (Republic of Congo),Atrocities committed by African Parks rangers against the Baka in the EU-funded Odzala-Kokoua National Park (Republic of Congo),Written question,9,2024-03-12,,Lydie MASSARD; François THIOLLET; Caroline ROOSE; Helmut SCHOLZ; Eugenia RODRÍGUEZ PALOP; Ignazio CORRAO; Marie TOUSSAINT; Pierre LARROUTUROU; Jordi SOLÉ; Francisco GUERREIRO,,English,https://data.europarl.europa.eu/distribution/reds_iMaQp/E-9-2024-000759/E-9-2024-000759_en.pdf,https://data.europarl.europa.eu/distribution/reds_iMaQp/E-9-2024-000759/E-9-2024-000759_en.docx,,,,,PE760.717,https://data.europarl.europa.eu/eli/dl/doc/E-9-2024-000759
E-9-2024-000739,Allocation of EU funds in support of margnalised Roma communities during the 2021-2027 financial period in Slovakia,Allocation of EU funds in support of margnalised Roma communities during the 2021-2027 financial period in Slovakia,Written question,9,2024-03-07,,Peter POLLÁK,,English,https://data.europarl.europa.eu/distribution/reds_iMaQp/E-9-2024-000739/E-9-2024-000739_en.pdf,https://data.europarl.europa.eu/distribution/reds_iMaQp/E-9-2024-000739/E-9-2024-000739_en.docx,,,,,PE760.586,https://data.europarl.europa.eu/eli/dl/doc/E-9-2024-000739
E-9-2024-000773,Interpretation of the concept of ‘final recipient’ under the Recovery and Resilience Facility,Interpretation of the concept of ‘final recipient’ under the Recovery and Resilience Facility,Written question,9,2024-03-13,,Bert-Jan RUISSEN,,English,https://data.europarl.europa.eu/distribution/reds_iMaQp/E-9-2024-000773/E-9-2024-000773_en.pdf,https://data.europarl.europa.eu/distribution/reds_iMaQp/E-9-2024-000773/E-9-2024-000773_en.docx,,,,,PE760.731,https://data.europarl.europa.eu/eli/dl/doc/E-9-2024-000773
E-9-2024-000676,Arising threats and regulation of artificial intelligence systems for human resource management,Arising threats and regulation of artificial intelligence systems for human resource management,Written question,9,2024-03-01,,Vilija BLINKEVIČIŪTĖ,,English,https://data.europarl.europa.eu/distribution/reds_iMaQp/E-9-2024-000676/E-9-2024-000676_en.pdf,https://data.europarl.europa.eu/distribution/reds_iMaQp/E-9-2024-000676/E-9-2024-000676_en.docx,,,,,PE760.221,https://data.europarl.europa.eu/eli/dl/doc/E-9-2024-000676
E-9-2024-000706,Access to in-vehicle data,Access to in-vehicle data,Written question,9,2024-03-06,,Thomas RUDNER,,English,https://data.europarl.europa.eu/distribution/reds_iMaQp/E-9-2024-000706/E-9-2024-000706_en.pdf,https://data.europarl.europa.eu/distribution/reds_iMaQp/E-9-2024-000706/E-9-2024-000706_en.docx,,,,,PE760.553,https://data.europarl.europa.eu/eli/dl/doc/E-9-2024-000706
E-9-2024-000656,Legislative proposal on the screening and registration of asbestos in buildings,Legislative proposal on the screening and registration of asbestos in buildings,Written question,9,2024-02-28,,Nikolaj VILLUMSEN,,English,https://data.europarl.europa.eu/distribution/reds_iMaQp/E-9-2024-000656/E-9-2024-000656_en.pdf,https://data.europarl.europa.eu/distribution/reds_iMaQp/E-9-2024-000656/E-9-2024-000656_en.docx,,,,,PE760.289,https://data.europarl.europa.eu/eli/dl/doc/E-9-2024-000656
E-9-2024-000657,Propriety of the Ukrainian President’s interference in Italian affairs,Propriety of the Ukrainian President’s interference in Italian affairs,Written question,9,2024-02-28,,Piernicola PEDICINI,,English,https://data.europarl.europa.eu/distribution/reds_iMaQp/E-9-2024-000657/E-9-2024-000657_en.pdf,https://data.europarl.europa.eu/distribution/reds_iMaQp/E-9-2024-000657/E-9-2024-000657_en.docx,,,,,PE760.290,https://data.europarl.europa.eu/eli/dl/doc/E-9-2024-000657
E-9-2024-000722,Commission Strategy for the Rights of Persons with Disabilities 2021-2030,Commission Strategy for the Rights of Persons with Disabilities 2021-2030,Written question,9,2024-03-06,,Josef MIHÁL,,English,https://data.europarl.europa.eu/distribution/reds_iMaQp/E-9-2024-000722/E-9-2024-000722_en.pdf,https://data.europarl.europa.eu/distribution/reds_iMaQp/E-9-2024-000722/E-9-2024-000722_en.docx,,,,,PE760.569,https://data.europarl.europa.eu/eli/dl/doc/E-9-2024-000722
E-9-2024-000754,Microbiome-based solutions for healthier and more sustainable food systems,Microbiome-based solutions for healthier and more sustainable food systems,Written question,9,2024-03-11,,Sirpa PIETIKÄINEN,,English,https://data.europarl.europa.eu/distribution/reds_iMaQp/E-9-2024-000754/E-9-2024-000754_en.pdf,https://data.europarl.europa.eu/distribution/reds_iMaQp/E-9-2024-000754/E-9-2024-000754_en.docx,,,,,PE760.712,https://data.europarl.europa.eu/eli/dl/doc/E-9-2024-000754
E-9-2024-000750,EU humanitarian aid blocked at the Rafah crossing,EU humanitarian aid blocked at the Rafah crossing,Written question,9,2024-03-08,,Giuliano PISAPIA; Brando BENIFEI; Alessandra MORETTI,,English,https://data.europarl.europa.eu/distribution/reds_iMaQp/E-9-2024-000750/E-9-2024-000750_en.pdf,https://data.europarl.europa.eu/distribution/reds_iMaQp/E-9-2024-000750/E-9-2024-000750_en.docx,,,,,PE760.708,https://data.europarl.europa.eu/eli/dl/doc/E-9-2024-000750
