document_identifier,document_title,document_title_en,document_type,document_parliamentary_term,document_date,document_public_register_notation,document_creator_person,document_creator_organization,document_language,document_pdf,document_doc,document_answers_pdf,document_answers_doc,document_annexes_pdf,document_annexes_doc,document_ep_number,document_URI
E-9-2024-000258,Plastic pellet pollution in the western Mediterranean Sea,Plastic pellet pollution in the western Mediterranean Sea,Written question,9,2024-01-29,,Antoni COMÍN I OLIVERES; Carles PUIGDEMONT I CASAMAJÓ,,English,https://data.europarl.europa.eu/distribution/reds_iMaQp/E-9-2024-000258/E-9-2024-000258_en.pdf,https://data.europarl.europa.eu/distribution/reds_iMaQp/E-9-2024-000258/E-9-2024-000258_en.docx,https://data.europarl.europa.eu/distribution/reds_iMaQp_Asw/E-9-2024-000258-ASW/E-9-2024-000258-ASW-FF_en.pdf,https://data.europarl.europa.eu/distribution/reds_iMaQp_Asw/E-9-2024-000258-ASW/E-9-2024-000258-ASW_en.docx,,,PE759.168,https://data.europarl.europa.eu/eli/dl/doc/E-9-2024-000258
E-9-2024-000314,Update of the EU regulation on Civil aviation to include UAP reporting,Update of the EU regulation on Civil aviation to include UAP reporting,Written question,9,2024-01-31,,Francisco GUERREIRO,,English,https://data.europarl.europa.eu/distribution/reds_iMaQp/E-9-2024-000314/E-9-2024-000314_en.pdf,https://data.europarl.europa.eu/distribution/reds_iMaQp/E-9-2024-000314/E-9-2024-000314_en.docx,https://data.europarl.europa.eu/distribution/reds_iMaQp_Asw/E-9-2024-000314-ASW/E-9-2024-000314-ASW_en.pdf,https://data.europarl.europa.eu/distribution/reds_iMaQp_Asw/E-9-2024-000314-ASW/E-9-2024-000314-ASW_en.docx,,,PE759.213,https://data.europarl.europa.eu/eli/dl/doc/E-9-2024-000314
E-9-2024-000330,Job losses owing to the transition to electric vehicles,Job losses owing to the transition to electric vehicles,Written question,9,2024-02-01,,Isabella TOVAGLIERI,,English,https://data.europarl.europa.eu/distribution/reds_iMaQp/E-9-2024-000330/E-9-2024-000330_en.pdf,https://data.europarl.europa.eu/distribution/reds_iMaQp/E-9-2024-000330/E-9-2024-000330_en.docx,https://data.europarl.europa.eu/distribution/reds_iMaQp_Asw/E-9-2024-000330-ASW/E-9-2024-000330-ASW_en.pdf,https://data.europarl.europa.eu/distribution/reds_iMaQp_Asw/E-9-2024-000330-ASW/E-9-2024-000330-ASW_en.docx,,,PE759.229,https://data.europarl.europa.eu/eli/dl/doc/E-9-2024-000330
E-9-2024-000373,Raw materials reserves for more strategic autonomy,Raw materials reserves for more strategic autonomy,Written question,9,2024-02-05,,Engin EROGLU,,English,https://data.europarl.europa.eu/distribution/reds_iMaQp/E-9-2024-000373/E-9-2024-000373_en.pdf,https://data.europarl.europa.eu/distribution/reds_iMaQp/E-9-2024-000373/E-9-2024-000373_en.docx,https://data.europarl.europa.eu/distribution/reds_iMaQp_Asw/E-9-2024-000373-ASW/E-9-2024-000373-ASW-FF_en.pdf,https://data.europarl.europa.eu/distribution/reds_iMaQp_Asw/E-9-2024-000373-ASW/E-9-2024-000373-ASW_en.docx,,,PE759.272,https://data.europarl.europa.eu/eli/dl/doc/E-9-2024-000373
E-9-2024-000372,Additional measures for the protection of particularly exposed and vulnerable habitats of specific animal species such as the black olm,Additional measures for the protection of particularly exposed and vulnerable habitats of specific animal species such as the black olm,Written question,9,2024-02-05,,Ljudmila NOVAK; Manuela RIPA; Valter FLEGO; Irena JOVEVA; Martin BUSCHMANN; Klemen GROŠELJ; Anja HAZEKAMP; Ville NIINISTÖ; Marie TOUSSAINT; Milan BRGLEZ; Ivan Vilibor SINČIĆ,,English,https://data.europarl.europa.eu/distribution/reds_iMaQp/E-9-2024-000372/E-9-2024-000372_en.pdf,https://data.europarl.europa.eu/distribution/reds_iMaQp/E-9-2024-000372/E-9-2024-000372_en.docx,https://data.europarl.europa.eu/distribution/reds_iMaQp_Asw/E-9-2024-000372-ASW/E-9-2024-000372-ASW_en.pdf,https://data.europarl.europa.eu/distribution/reds_iMaQp_Asw/E-9-2024-000372-ASW/E-9-2024-000372-ASW_en.docx,,,PE759.271,https://data.europarl.europa.eu/eli/dl/doc/E-9-2024-000372
E-9-2024-000280,Serious damage to ‘Parco dello Stelvio’ Natura 2000 site (ZPS IT2040044) and ‘Tresero - Dosso del Vallon’ national nature reserve,Serious damage to ‘Parco dello Stelvio’ Natura 2000 site (ZPS IT2040044) and ‘Tresero - Dosso del Vallon’ national nature reserve,Written question,9,2024-01-30,,Maria Angela DANZÌ; Sabrina PIGNEDOLI; Mario FURORE; Tiziana BEGHIN; Laura FERRARA,,English,https://data.europarl.europa.eu/distribution/reds_iMaQp/E-9-2024-000280/E-9-2024-000280_en.pdf,https://data.europarl.europa.eu/distribution/reds_iMaQp/E-9-2024-000280/E-9-2024-000280_en.docx,https://data.europarl.europa.eu/distribution/reds_iMaQp_Asw/E-9-2024-000280-ASW/E-9-2024-000280-ASW_en.pdf,https://data.europarl.europa.eu/distribution/reds_iMaQp_Asw/E-9-2024-000280-ASW/E-9-2024-000280-ASW_en.docx,,,PE759.187,https://data.europarl.europa.eu/eli/dl/doc/E-9-2024-000280
E-9-2024-000359,Redesigning the economy so that there is no dependence on foreign workers,Redesigning the economy so that there is no dependence on foreign workers,Written question,9,2024-02-02,,Emmanouil FRAGKOS,,English,https://data.europarl.europa.eu/distribution/reds_iMaQp/E-9-2024-000359/E-9-2024-000359_en.pdf,https://data.europarl.europa.eu/distribution/reds_iMaQp/E-9-2024-000359/E-9-2024-000359_en.docx,https://data.europarl.europa.eu/distribution/reds_iMaQp_Asw/E-9-2024-000359-ASW/E-9-2024-000359-ASW-FF_en.pdf,https://data.europarl.europa.eu/distribution/reds_iMaQp_Asw/E-9-2024-000359-ASW/E-9-2024-000359-ASW_en.docx,,,PE759.258,https://data.europarl.europa.eu/eli/dl/doc/E-9-2024-000359
E-9-2024-000377,The announcement concerning establishment of private universities in Greece,The announcement concerning establishment of private universities in Greece,Written question,9,2024-02-06,,Lefteris NIKOLAOU-ALAVANOS; Kostas PAPADAKIS,,English,https://data.europarl.europa.eu/distribution/reds_iMaQp/E-9-2024-000377/E-9-2024-000377_en.pdf,https://data.europarl.europa.eu/distribution/reds_iMaQp/E-9-2024-000377/E-9-2024-000377_en.docx,https://data.europarl.europa.eu/distribution/reds_iMaQp_Asw/E-9-2024-000377-ASW/E-9-2024-000377-ASW-FF_en.pdf,https://data.europarl.europa.eu/distribution/reds_iMaQp_Asw/E-9-2024-000377-ASW/E-9-2024-000377-ASW_en.docx,,,PE759.276,https://data.europarl.europa.eu/eli/dl/doc/E-9-2024-000377
E-9-2024-000374,A full review of the EIOPA report on Euroins Romania,A full review of the EIOPA report on Euroins Romania,Written question,9,2024-02-06,,Robert ROOS,,English,https://data.europarl.europa.eu/distribution/reds_iMaQp/E-9-2024-000374/E-9-2024-000374_en.pdf,https://data.europarl.europa.eu/distribution/reds_iMaQp/E-9-2024-000374/E-9-2024-000374_en.docx,https://data.europarl.europa.eu/distribution/reds_iMaQp_Asw/E-9-2024-000228-ASW/E-9-2024-000228-ASW_en.pdf,https://data.europarl.europa.eu/distribution/reds_iMaQp_Asw/E-9-2024-000228-ASW/E-9-2024-000228-ASW_en.docx,,,PE759.273,https://data.europarl.europa.eu/eli/dl/doc/E-9-2024-000374
E-9-2024-000365,Uber’s business conduct and impact on competition in the EU market,Uber’s business conduct and impact on competition in the EU market,Written question,9,2024-02-02,,Susanna CECCARDI,,English,https://data.europarl.europa.eu/distribution/reds_iMaQp/E-9-2024-000365/E-9-2024-000365_en.pdf,https://data.europarl.europa.eu/distribution/reds_iMaQp/E-9-2024-000365/E-9-2024-000365_en.docx,https://data.europarl.europa.eu/distribution/reds_iMaQp_Asw/E-9-2024-000365-ASW/E-9-2024-000365-ASW_en.pdf,https://data.europarl.europa.eu/distribution/reds_iMaQp_Asw/E-9-2024-000365-ASW/E-9-2024-000365-ASW_en.docx,,,PE759.264,https://data.europarl.europa.eu/eli/dl/doc/E-9-2024-000365
E-9-2024-000369,Strengthening the principle of consent in EU legislation on gender-based violence,Strengthening the principle of consent in EU legislation on gender-based violence,Written question,9,2024-02-05,,Gianna GANCIA,,English,https://data.europarl.europa.eu/distribution/reds_iMaQp/E-9-2024-000369/E-9-2024-000369_en.pdf,https://data.europarl.europa.eu/distribution/reds_iMaQp/E-9-2024-000369/E-9-2024-000369_en.docx,https://data.europarl.europa.eu/distribution/reds_iMaQp_Asw/E-9-2024-000369-ASW/E-9-2024-000369-ASW_en.pdf,https://data.europarl.europa.eu/distribution/reds_iMaQp_Asw/E-9-2024-000369-ASW/E-9-2024-000369-ASW_en.docx,,,PE759.268,https://data.europarl.europa.eu/eli/dl/doc/E-9-2024-000369
E-9-2024-000379,Plans to allow flights with only one pilot in the cockpit and passenger and pilot safety,Plans to allow flights with only one pilot in the cockpit and passenger and pilot safety,Written question,9,2024-02-06,,Kosma ZŁOTOWSKI,,English,https://data.europarl.europa.eu/distribution/reds_iMaQp/E-9-2024-000379/E-9-2024-000379_en.pdf,https://data.europarl.europa.eu/distribution/reds_iMaQp/E-9-2024-000379/E-9-2024-000379_en.docx,https://data.europarl.europa.eu/distribution/reds_iMaQp_Asw/E-9-2024-000379-ASW/E-9-2024-000379-ASW_en.pdf,https://data.europarl.europa.eu/distribution/reds_iMaQp_Asw/E-9-2024-000379-ASW/E-9-2024-000379-ASW_en.docx,,,PE759.278,https://data.europarl.europa.eu/eli/dl/doc/E-9-2024-000379
E-9-2024-000284,An EU-Russia modus vivendi,An EU-Russia modus vivendi,Written question,9,2024-01-30,,Emmanouil FRAGKOS,,English,https://data.europarl.europa.eu/distribution/reds_iMaQp/E-9-2024-000284/E-9-2024-000284_en.pdf,https://data.europarl.europa.eu/distribution/reds_iMaQp/E-9-2024-000284/E-9-2024-000284_en.docx,https://data.europarl.europa.eu/distribution/reds_iMaQp_Asw/E-9-2024-000284-ASW/E-9-2024-000284-ASW-FF_en.pdf,https://data.europarl.europa.eu/distribution/reds_iMaQp_Asw/E-9-2024-000284-ASW/E-9-2024-000284-ASW_en.docx,,,PE759.191,https://data.europarl.europa.eu/eli/dl/doc/E-9-2024-000284
E-9-2024-000342,Recycling of milk glass,Recycling of milk glass,Written question,9,2024-02-02,,Aurélia BEIGNEUX,,English,https://data.europarl.europa.eu/distribution/reds_iMaQp/E-9-2024-000342/E-9-2024-000342_en.pdf,https://data.europarl.europa.eu/distribution/reds_iMaQp/E-9-2024-000342/E-9-2024-000342_en.docx,https://data.europarl.europa.eu/distribution/reds_iMaQp_Asw/E-9-2024-000342-ASW/E-9-2024-000342-ASW-FF_en.pdf,https://data.europarl.europa.eu/distribution/reds_iMaQp_Asw/E-9-2024-000342-ASW/E-9-2024-000342-ASW_en.docx,,,PE759.241,https://data.europarl.europa.eu/eli/dl/doc/E-9-2024-000342
E-9-2024-000273,Measures to prevent the construction of a fuel storage and distribution facility in the port of Alicante,Measures to prevent the construction of a fuel storage and distribution facility in the port of Alicante,Written question,9,2024-01-30,,Manu PINEDA,,English,https://data.europarl.europa.eu/distribution/reds_iMaQp/E-9-2024-000273/E-9-2024-000273_en.pdf,https://data.europarl.europa.eu/distribution/reds_iMaQp/E-9-2024-000273/E-9-2024-000273_en.docx,https://data.europarl.europa.eu/distribution/reds_iMaQp_Asw/E-9-2024-000273-ASW/E-9-2024-000273-ASW-FF_en.pdf,https://data.europarl.europa.eu/distribution/reds_iMaQp_Asw/E-9-2024-000273-ASW/E-9-2024-000273-ASW_en.docx,,,PE759.183,https://data.europarl.europa.eu/eli/dl/doc/E-9-2024-000273
E-9-2024-000267,Deregulation of NGTs,Deregulation of NGTs,Written question,9,2024-01-29,,Roman HAIDER,,English,https://data.europarl.europa.eu/distribution/reds_iMaQp/E-9-2024-000267/E-9-2024-000267_en.pdf,https://data.europarl.europa.eu/distribution/reds_iMaQp/E-9-2024-000267/E-9-2024-000267_en.docx,https://data.europarl.europa.eu/distribution/reds_iMaQp_Asw/E-9-2024-000267-ASW/E-9-2024-000267-ASW_en.pdf,https://data.europarl.europa.eu/distribution/reds_iMaQp_Asw/E-9-2024-000267-ASW/E-9-2024-000267-ASW_en.docx,,,PE759.177,https://data.europarl.europa.eu/eli/dl/doc/E-9-2024-000267
E-9-2024-000300,Exclusion of certain higher education institutions from the agreement between Greece and Cyprus on the mutual recognition of qualifications,Exclusion of certain higher education institutions from the agreement between Greece and Cyprus on the mutual recognition of qualifications,Written question,9,2024-01-31,,Eleni STAVROU,,English,https://data.europarl.europa.eu/distribution/reds_iMaQp/E-9-2024-000300/E-9-2024-000300_en.pdf,https://data.europarl.europa.eu/distribution/reds_iMaQp/E-9-2024-000300/E-9-2024-000300_en.docx,https://data.europarl.europa.eu/distribution/reds_iMaQp_Asw/E-9-2024-000300-ASW/E-9-2024-000300-ASW_en.pdf,https://data.europarl.europa.eu/distribution/reds_iMaQp_Asw/E-9-2024-000300-ASW/E-9-2024-000300-ASW_en.docx,,,PE758.383,https://data.europarl.europa.eu/eli/dl/doc/E-9-2024-000300
E-9-2024-000347,The construction and operation of wind energy projects despite objections from local councillors,The construction and operation of wind energy projects despite objections from local councillors,Written question,9,2024-02-02,,Aurélia BEIGNEUX,,English,https://data.europarl.europa.eu/distribution/reds_iMaQp/E-9-2024-000347/E-9-2024-000347_en.pdf,https://data.europarl.europa.eu/distribution/reds_iMaQp/E-9-2024-000347/E-9-2024-000347_en.docx,https://data.europarl.europa.eu/distribution/reds_iMaQp_Asw/E-9-2024-000347-ASW/E-9-2024-000347-ASW_en.pdf,https://data.europarl.europa.eu/distribution/reds_iMaQp_Asw/E-9-2024-000347-ASW/E-9-2024-000347-ASW_en.docx,,,PE759.246,https://data.europarl.europa.eu/eli/dl/doc/E-9-2024-000347
E-9-2024-000303,Measures to solve the problems farmers are facing and ways of supporting the agricultural sector,Measures to solve the problems farmers are facing and ways of supporting the agricultural sector,Written question,9,2024-01-31,,Nikos PAPANDREOU,,English,https://data.europarl.europa.eu/distribution/reds_iMaQp/E-9-2024-000303/E-9-2024-000303_en.pdf,https://data.europarl.europa.eu/distribution/reds_iMaQp/E-9-2024-000303/E-9-2024-000303_en.docx,https://data.europarl.europa.eu/distribution/reds_iMaQp_Asw/E-9-2024-000303-ASW/E-9-2024-000303-ASW_en.pdf,https://data.europarl.europa.eu/distribution/reds_iMaQp_Asw/E-9-2024-000303-ASW/E-9-2024-000303-ASW_en.docx,,,PE758.492,https://data.europarl.europa.eu/eli/dl/doc/E-9-2024-000303
E-9-2024-000299,Impact of designated Natura sites in the Republic of Cyprus,Impact of designated Natura sites in the Republic of Cyprus,Written question,9,2024-01-31,,Eleni STAVROU,,English,https://data.europarl.europa.eu/distribution/reds_iMaQp/E-9-2024-000299/E-9-2024-000299_en.pdf,https://data.europarl.europa.eu/distribution/reds_iMaQp/E-9-2024-000299/E-9-2024-000299_en.docx,https://data.europarl.europa.eu/distribution/reds_iMaQp_Asw/E-9-2024-000299-ASW/E-9-2024-000299-ASW_en.pdf,https://data.europarl.europa.eu/distribution/reds_iMaQp_Asw/E-9-2024-000299-ASW/E-9-2024-000299-ASW_en.docx,,,PE758.382,https://data.europarl.europa.eu/eli/dl/doc/E-9-2024-000299
E-9-2024-000334,Europe’s industrial decline and public policies to address it,Europe’s industrial decline and public policies to address it,Written question,9,2024-02-01,,Mathilde ANDROUËT,,English,https://data.europarl.europa.eu/distribution/reds_iMaQp/E-9-2024-000334/E-9-2024-000334_en.pdf,https://data.europarl.europa.eu/distribution/reds_iMaQp/E-9-2024-000334/E-9-2024-000334_en.docx,https://data.europarl.europa.eu/distribution/reds_iMaQp_Asw/E-9-2024-000334-ASW/E-9-2024-000334-ASW-FF_en.pdf,https://data.europarl.europa.eu/distribution/reds_iMaQp_Asw/E-9-2024-000334-ASW/E-9-2024-000334-ASW_en.docx,,,PE759.233,https://data.europarl.europa.eu/eli/dl/doc/E-9-2024-000334
E-9-2024-000293,CleanHME programme and ‘low-energy nuclear reactions’ (LENR),CleanHME programme and ‘low-energy nuclear reactions’ (LENR),Written question,9,2024-01-31,,Aldo PATRICIELLO,,English,https://data.europarl.europa.eu/distribution/reds_iMaQp/E-9-2024-000293/E-9-2024-000293_en.pdf,https://data.europarl.europa.eu/distribution/reds_iMaQp/E-9-2024-000293/E-9-2024-000293_en.docx,https://data.europarl.europa.eu/distribution/reds_iMaQp_Asw/E-9-2024-000293-ASW/E-9-2024-000293-ASW_en.pdf,https://data.europarl.europa.eu/distribution/reds_iMaQp_Asw/E-9-2024-000293-ASW/E-9-2024-000293-ASW_en.docx,,,PE759.199,https://data.europarl.europa.eu/eli/dl/doc/E-9-2024-000293
E-9-2024-000337,Sustainability of ArianeGroup in the ESA’s European space strategy,Sustainability of ArianeGroup in the ESA’s European space strategy,Written question,9,2024-02-01,,Mathilde ANDROUËT,,English,https://data.europarl.europa.eu/distribution/reds_iMaQp/E-9-2024-000337/E-9-2024-000337_en.pdf,https://data.europarl.europa.eu/distribution/reds_iMaQp/E-9-2024-000337/E-9-2024-000337_en.docx,https://data.europarl.europa.eu/distribution/reds_iMaQp_Asw/E-9-2024-000337-ASW/E-9-2024-000337-ASW-FF_en.pdf,https://data.europarl.europa.eu/distribution/reds_iMaQp_Asw/E-9-2024-000337-ASW/E-9-2024-000337-ASW_en.docx,,,PE759.236,https://data.europarl.europa.eu/eli/dl/doc/E-9-2024-000337
E-9-2024-000357,"Creation of a mini-Schengen zone between Bulgaria, Romania and Greece","Creation of a mini-Schengen zone between Bulgaria, Romania and Greece",Written question,9,2024-02-02,,Ilhan KYUCHYUK,,English,https://data.europarl.europa.eu/distribution/reds_iMaQp/E-9-2024-000357/E-9-2024-000357_en.pdf,https://data.europarl.europa.eu/distribution/reds_iMaQp/E-9-2024-000357/E-9-2024-000357_en.docx,https://data.europarl.europa.eu/distribution/reds_iMaQp_Asw/E-9-2024-000357-ASW/E-9-2024-000357-ASW-FF_en.pdf,https://data.europarl.europa.eu/distribution/reds_iMaQp_Asw/E-9-2024-000357-ASW/E-9-2024-000357-ASW_en.docx,,,PE759.256,https://data.europarl.europa.eu/eli/dl/doc/E-9-2024-000357
E-9-2024-000378,Support to EU regions and municipalities against foreign interference in the EU elections,Support to EU regions and municipalities against foreign interference in the EU elections,Written question,9,2024-02-06,,Engin EROGLU,,English,https://data.europarl.europa.eu/distribution/reds_iMaQp/E-9-2024-000378/E-9-2024-000378_en.pdf,https://data.europarl.europa.eu/distribution/reds_iMaQp/E-9-2024-000378/E-9-2024-000378_en.docx,https://data.europarl.europa.eu/distribution/reds_iMaQp_Asw/E-9-2024-000378-ASW/E-9-2024-000378-ASW_en.pdf,https://data.europarl.europa.eu/distribution/reds_iMaQp_Asw/E-9-2024-000378-ASW/E-9-2024-000378-ASW_en.docx,,,PE759.277,https://data.europarl.europa.eu/eli/dl/doc/E-9-2024-000378
E-9-2024-000383,Basel III – a level playing field,Basel III – a level playing field,Written question,9,2024-02-06,,Engin EROGLU,,English,https://data.europarl.europa.eu/distribution/reds_iMaQp/E-9-2024-000383/E-9-2024-000383_en.pdf,https://data.europarl.europa.eu/distribution/reds_iMaQp/E-9-2024-000383/E-9-2024-000383_en.docx,https://data.europarl.europa.eu/distribution/reds_iMaQp_Asw/E-9-2024-000383-ASW/E-9-2024-000383-ASW_en.pdf,https://data.europarl.europa.eu/distribution/reds_iMaQp_Asw/E-9-2024-000383-ASW/E-9-2024-000383-ASW_en.docx,,,PE759.282,https://data.europarl.europa.eu/eli/dl/doc/E-9-2024-000383
E-9-2024-000332,Imports of Ukrainian agricultural products and a farming crisis in Europe,Imports of Ukrainian agricultural products and a farming crisis in Europe,Written question,9,2024-02-01,,Mathilde ANDROUËT,,English,https://data.europarl.europa.eu/distribution/reds_iMaQp/E-9-2024-000332/E-9-2024-000332_en.pdf,https://data.europarl.europa.eu/distribution/reds_iMaQp/E-9-2024-000332/E-9-2024-000332_en.docx,https://data.europarl.europa.eu/distribution/reds_iMaQp_Asw/E-9-2024-000332-ASW/E-9-2024-000332-ASW-FF_en.pdf,https://data.europarl.europa.eu/distribution/reds_iMaQp_Asw/E-9-2024-000332-ASW/E-9-2024-000332-ASW_en.docx,,,PE759.231,https://data.europarl.europa.eu/eli/dl/doc/E-9-2024-000332
E-9-2024-000355,Lobbies calling for mRNA vaccines not to be classified as gene therapy,Lobbies calling for mRNA vaccines not to be classified as gene therapy,Written question,9,2024-02-02,,Virginie JORON,,English,https://data.europarl.europa.eu/distribution/reds_iMaQp/E-9-2024-000355/E-9-2024-000355_en.pdf,https://data.europarl.europa.eu/distribution/reds_iMaQp/E-9-2024-000355/E-9-2024-000355_en.docx,https://data.europarl.europa.eu/distribution/reds_iMaQp_Asw/E-9-2024-000355-ASW/E-9-2024-000355-ASW_en.pdf,https://data.europarl.europa.eu/distribution/reds_iMaQp_Asw/E-9-2024-000355-ASW/E-9-2024-000355-ASW_en.docx,,,PE759.254,https://data.europarl.europa.eu/eli/dl/doc/E-9-2024-000355
E-9-2024-000340,"Conectando Oviedo project implementation, ERDF funds","Conectando Oviedo project implementation, ERDF funds",Written question,9,2024-02-02,,Manu PINEDA,,English,,https://data.europarl.europa.eu/distribution/reds_iMaQp/E-9-2024-000340/E-9-2024-000340_en.docx,https://data.europarl.europa.eu/distribution/reds_iMaQp_Asw/E-9-2024-000340-ASW/E-9-2024-000340-ASW-FF_en.pdf,https://data.europarl.europa.eu/distribution/reds_iMaQp_Asw/E-9-2024-000340-ASW/E-9-2024-000340-ASW_en.docx,,,PE759.239,https://data.europarl.europa.eu/eli/dl/doc/E-9-2024-000340
E-9-2024-000297,New unjustified attack on Spanish agri-food lorry drivers at the border with France,New unjustified attack on Spanish agri-food lorry drivers at the border with France,Written question,9,2024-01-31,,Juan Ignacio ZOIDO ÁLVAREZ,,English,https://data.europarl.europa.eu/distribution/reds_iMaQp/E-9-2024-000297/E-9-2024-000297_en.pdf,https://data.europarl.europa.eu/distribution/reds_iMaQp/E-9-2024-000297/E-9-2024-000297_en.docx,,,,,PE758.490,https://data.europarl.europa.eu/eli/dl/doc/E-9-2024-000297
E-9-2024-000370,Fascist salute is not a crime unless it is a risk to public order,Fascist salute is not a crime unless it is a risk to public order,Written question,9,2024-02-05,,Pierre KARLESKIND; Thijs REUTEN; Robert BIEDROŃ; Pina PICIERNO; Ibán GARCÍA DEL BLANCO; Paul TANG; Irena JOVEVA; Hannah NEUMANN; Damien CARÊME; Peter POLLÁK; Mounir SATOURI; Dietmar KÖSTER; Eugenia RODRÍGUEZ PALOP; Pierre LARROUTUROU; Ivan Vilibor SINČIĆ; Isabel SANTOS; Cyrus ENGERER; Matjaž NEMEC,,English,https://data.europarl.europa.eu/distribution/reds_iMaQp/E-9-2024-000370/E-9-2024-000370_en.pdf,https://data.europarl.europa.eu/distribution/reds_iMaQp/E-9-2024-000370/E-9-2024-000370_en.docx,,,,,PE759.269,https://data.europarl.europa.eu/eli/dl/doc/E-9-2024-000370
E-9-2024-000295,UNRWA – 10 % of workers linked to Hamas,UNRWA – 10 % of workers linked to Hamas,Written question,9,2024-01-31,,Monika HOHLMEIER,,English,https://data.europarl.europa.eu/distribution/reds_iMaQp/E-9-2024-000295/E-9-2024-000295_en.pdf,https://data.europarl.europa.eu/distribution/reds_iMaQp/E-9-2024-000295/E-9-2024-000295_en.docx,,,,,PE759.201,https://data.europarl.europa.eu/eli/dl/doc/E-9-2024-000295
E-9-2024-000313,"Need for continued EU support to UNRWA given the threat of funding cuts, with the consequent effects on the lives of Gaza’s people","Need for continued EU support to UNRWA given the threat of funding cuts, with the consequent effects on the lives of Gaza’s people",Written question,9,2024-01-31,,Ana MIRANDA,,English,https://data.europarl.europa.eu/distribution/reds_iMaQp/E-9-2024-000313/E-9-2024-000313_en.pdf,https://data.europarl.europa.eu/distribution/reds_iMaQp/E-9-2024-000313/E-9-2024-000313_en.docx,,,,,PE759.212,https://data.europarl.europa.eu/eli/dl/doc/E-9-2024-000313
E-9-2024-000275,Urgent need to take measures at European level to combat shrinkflation,Urgent need to take measures at European level to combat shrinkflation,Written question,9,2024-01-30,,Dimitrios PAPADIMOULIS,,English,https://data.europarl.europa.eu/distribution/reds_iMaQp/E-9-2024-000275/E-9-2024-000275_en.pdf,https://data.europarl.europa.eu/distribution/reds_iMaQp/E-9-2024-000275/E-9-2024-000275_en.docx,,,,,PE758.698,https://data.europarl.europa.eu/eli/dl/doc/E-9-2024-000275
E-9-2024-000274,"International Day of Commemoration in Memory of the Victims of the Holocaust, and the Commission’s whitewashing of Germany’s responsibility for the Holocaust","International Day of Commemoration in Memory of the Victims of the Holocaust, and the Commission’s whitewashing of Germany’s responsibility for the Holocaust",Written question,9,2024-01-30,,Anna FOTYGA,,English,https://data.europarl.europa.eu/distribution/reds_iMaQp/E-9-2024-000274/E-9-2024-000274_en.pdf,https://data.europarl.europa.eu/distribution/reds_iMaQp/E-9-2024-000274/E-9-2024-000274_en.docx,,,,,PE758.697,https://data.europarl.europa.eu/eli/dl/doc/E-9-2024-000274
E-9-2024-000294,EU response to the space capabilities of the People’s Liberation Army,EU response to the space capabilities of the People’s Liberation Army,Written question,9,2024-01-31,,Bart GROOTHUIS; Petras AUŠTREVIČIUS,,English,https://data.europarl.europa.eu/distribution/reds_iMaQp/E-9-2024-000294/E-9-2024-000294_en.pdf,https://data.europarl.europa.eu/distribution/reds_iMaQp/E-9-2024-000294/E-9-2024-000294_en.docx,,,,,PE759.200,https://data.europarl.europa.eu/eli/dl/doc/E-9-2024-000294
E-9-2024-000354,Suspension of the disbursement of funds for UNRWA in Gaza,Suspension of the disbursement of funds for UNRWA in Gaza,Written question,9,2024-02-02,,Massimiliano SMERIGLIO; Rosa D'AMATO,,English,https://data.europarl.europa.eu/distribution/reds_iMaQp/E-9-2024-000354/E-9-2024-000354_en.pdf,https://data.europarl.europa.eu/distribution/reds_iMaQp/E-9-2024-000354/E-9-2024-000354_en.docx,,,,,PE759.253,https://data.europarl.europa.eu/eli/dl/doc/E-9-2024-000354
E-9-2024-000366,Frontex reveals rescue was not objective of Greek authorities in Pylos shipwreck,Frontex reveals rescue was not objective of Greek authorities in Pylos shipwreck,Written question,9,2024-02-02,,Stelios KOULOGLOU,,English,https://data.europarl.europa.eu/distribution/reds_iMaQp/E-9-2024-000366/E-9-2024-000366_en.pdf,https://data.europarl.europa.eu/distribution/reds_iMaQp/E-9-2024-000366/E-9-2024-000366_en.docx,,,,,PE759.265,https://data.europarl.europa.eu/eli/dl/doc/E-9-2024-000366
