document_identifier,document_title,document_title_en,document_type,document_parliamentary_term,document_date,document_public_register_notation,document_creator_person,document_creator_organization,document_language,document_pdf,document_doc,document_answers_pdf,document_answers_doc,document_annexes_pdf,document_annexes_doc,document_ep_number,document_URI
E-9-2024-001056,Urgent need to assess the continuation of the EU-Ecuador trade agreement in the light of systematic human rights and sovereignty violations,Urgent need to assess the continuation of the EU-Ecuador trade agreement in the light of systematic human rights and sovereignty violations,Written question,9,2024-04-10,,Miguel URBÁN CRESPO,,English,https://data.europarl.europa.eu/distribution/reds_iMaQp/E-9-2024-001056/E-9-2024-001056_en.pdf,https://data.europarl.europa.eu/distribution/reds_iMaQp/E-9-2024-001056/E-9-2024-001056_en.docx,,,,,PE762.180,https://data.europarl.europa.eu/eli/dl/doc/E-9-2024-001056
E-9-2024-001067,Farmers’ participation in eco-schemes,Farmers’ participation in eco-schemes,Written question,9,2024-04-10,,Bronis ROPĖ,,,,,,,,,PE762.191,https://data.europarl.europa.eu/eli/dl/doc/E-9-2024-001067
E-9-2024-001054,Surge in migration flows from Lebanon to Cyprus,Surge in migration flows from Lebanon to Cyprus,Written question,9,2024-04-10,,Giorgos GEORGIOU,,English,https://data.europarl.europa.eu/distribution/reds_iMaQp/E-9-2024-001054/E-9-2024-001054_en.pdf,https://data.europarl.europa.eu/distribution/reds_iMaQp/E-9-2024-001054/E-9-2024-001054_en.docx,,,,,PE761.419,https://data.europarl.europa.eu/eli/dl/doc/E-9-2024-001054
E-9-2024-001048,Support for fisheries in the outermost regions,Support for fisheries in the outermost regions,Written question,9,2024-04-09,,Sandra PEREIRA,,English,https://data.europarl.europa.eu/distribution/reds_iMaQp/E-9-2024-001048/E-9-2024-001048_en.pdf,https://data.europarl.europa.eu/distribution/reds_iMaQp/E-9-2024-001048/E-9-2024-001048_en.docx,,,,,PE761.413,https://data.europarl.europa.eu/eli/dl/doc/E-9-2024-001048
E-9-2024-001049,Screening process after opening of accession negotiations with Bosnia and Herzegovina,Screening process after opening of accession negotiations with Bosnia and Herzegovina,Written question,9,2024-04-09,,Tineke STRIK,,English,https://data.europarl.europa.eu/distribution/reds_iMaQp/E-9-2024-001049/E-9-2024-001049_en.pdf,https://data.europarl.europa.eu/distribution/reds_iMaQp/E-9-2024-001049/E-9-2024-001049_en.docx,,,,,PE761.414,https://data.europarl.europa.eu/eli/dl/doc/E-9-2024-001049
E-9-2024-001287,Greek government’s decision to merge first instance courts unsettles workers and makes it harder to access judicial services,Greek government’s decision to merge first instance courts unsettles workers and makes it harder to access judicial services,Written question,9,2024-04-25,,Stelios KOULOGLOU,,English,https://data.europarl.europa.eu/distribution/reds_iMaQp/E-9-2024-001287/E-9-2024-001287_en.pdf,https://data.europarl.europa.eu/distribution/reds_iMaQp/E-9-2024-001287/E-9-2024-001287_en.docx,,,,,PE762.692,https://data.europarl.europa.eu/eli/dl/doc/E-9-2024-001287
E-9-2024-001294,Dortmund Airport’s aid application,Dortmund Airport’s aid application,Written question,9,2024-04-25,,Michael KAUCH,,English,https://data.europarl.europa.eu/distribution/reds_iMaQp/E-9-2024-001294/E-9-2024-001294_en.pdf,https://data.europarl.europa.eu/distribution/reds_iMaQp/E-9-2024-001294/E-9-2024-001294_en.docx,,,,,PE762.699,https://data.europarl.europa.eu/eli/dl/doc/E-9-2024-001294
E-9-2024-001292,Restricting the promotion and dissemination of violent music to protect society’s youngest members,Restricting the promotion and dissemination of violent music to protect society’s youngest members,Written question,9,2024-04-25,,Paolo BORCHIA,,English,https://data.europarl.europa.eu/distribution/reds_iMaQp/E-9-2024-001292/E-9-2024-001292_en.pdf,https://data.europarl.europa.eu/distribution/reds_iMaQp/E-9-2024-001292/E-9-2024-001292_en.docx,,,,,PE762.697,https://data.europarl.europa.eu/eli/dl/doc/E-9-2024-001292
E-9-2024-001295,Fire protection and firefighting resources,Fire protection and firefighting resources,Written question,9,2024-04-25,,Lefteris NIKOLAOU-ALAVANOS; Kostas PAPADAKIS,,English,https://data.europarl.europa.eu/distribution/reds_iMaQp/E-9-2024-001295/E-9-2024-001295_en.pdf,https://data.europarl.europa.eu/distribution/reds_iMaQp/E-9-2024-001295/E-9-2024-001295_en.docx,,,,,PE762.700,https://data.europarl.europa.eu/eli/dl/doc/E-9-2024-001295
E-9-2024-001209,Use of loans from the Recovery and Resilience Facility in Spain,Use of loans from the Recovery and Resilience Facility in Spain,Written question,9,2024-04-23,,Isabel BENJUMEA BENJUMEA,,English,https://data.europarl.europa.eu/distribution/reds_iMaQp/E-9-2024-001209/E-9-2024-001209_en.pdf,https://data.europarl.europa.eu/distribution/reds_iMaQp/E-9-2024-001209/E-9-2024-001209_en.docx,,,,,PE762.653,https://data.europarl.europa.eu/eli/dl/doc/E-9-2024-001209
E-9-2024-001191,Limiting the impact of import duties on Russian linseed,Limiting the impact of import duties on Russian linseed,Written question,9,2024-04-22,,Tom VANDENKENDELAERE,,English,https://data.europarl.europa.eu/distribution/reds_iMaQp/E-9-2024-001191/E-9-2024-001191_en.pdf,https://data.europarl.europa.eu/distribution/reds_iMaQp/E-9-2024-001191/E-9-2024-001191_en.docx,,,,,PE762.529,https://data.europarl.europa.eu/eli/dl/doc/E-9-2024-001191
E-9-2024-001299,EU election exploratory mission to Venezuela,EU election exploratory mission to Venezuela,Written question,9,2024-04-25,,Ana COLLADO JIMÉNEZ; Isabel BENJUMEA BENJUMEA; Pilar DEL CASTILLO VERA; Gabriel MATO; Francisco José MILLÁN MON; José Manuel GARCÍA-MARGALLO Y MARFIL; Antonio LÓPEZ-ISTÚRIZ WHITE; Javier ZARZALEJOS; María Soraya RODRÍGUEZ RAMOS; Leopoldo LÓPEZ GIL; Rosa ESTARÀS FERRAGUT; Javier NART; Dolors MONTSERRAT; José Ramón BAUZÁ DÍAZ,,English,https://data.europarl.europa.eu/distribution/reds_iMaQp/E-9-2024-001299/E-9-2024-001299_en.pdf,https://data.europarl.europa.eu/distribution/reds_iMaQp/E-9-2024-001299/E-9-2024-001299_en.docx,,,,,PE762.704,https://data.europarl.europa.eu/eli/dl/doc/E-9-2024-001299
E-9-2024-001297,Avian influenza,Avian influenza,Written question,9,2024-04-25,,Joanna KOPCIŃSKA,,English,https://data.europarl.europa.eu/distribution/reds_iMaQp/E-9-2024-001297/E-9-2024-001297_en.pdf,https://data.europarl.europa.eu/distribution/reds_iMaQp/E-9-2024-001297/E-9-2024-001297_en.docx,,,,,PE762.702,https://data.europarl.europa.eu/eli/dl/doc/E-9-2024-001297
E-9-2024-001230,Protection of shellfish waters under the Water Framework Directive,Protection of shellfish waters under the Water Framework Directive,Written question,9,2024-04-24,,Caroline ROOSE,,English,https://data.europarl.europa.eu/distribution/reds_iMaQp/E-9-2024-001230/E-9-2024-001230_en.pdf,https://data.europarl.europa.eu/distribution/reds_iMaQp/E-9-2024-001230/E-9-2024-001230_en.docx,,,,,PE762.674,https://data.europarl.europa.eu/eli/dl/doc/E-9-2024-001230
E-9-2024-001255,The persecution of the Bahá’í community in Iran,The persecution of the Bahá’í community in Iran,Written question,9,2024-04-24,,Jan-Christoph OETJEN; Fabio Massimo CASTALDO; Olivier CHASTEL,,English,https://data.europarl.europa.eu/distribution/reds_iMaQp/E-9-2024-001255/E-9-2024-001255_en.pdf,https://data.europarl.europa.eu/distribution/reds_iMaQp/E-9-2024-001255/E-9-2024-001255_en.docx,,,,,PE762.229,https://data.europarl.europa.eu/eli/dl/doc/E-9-2024-001255
E-9-2024-001186,Satellite-based EUROSUR surveillance in the pre-frontier area from 2022 onwards,Satellite-based EUROSUR surveillance in the pre-frontier area from 2022 onwards,Written question,9,2024-04-22,,Cornelia ERNST,,English,https://data.europarl.europa.eu/distribution/reds_iMaQp/E-9-2024-001186/E-9-2024-001186_en.pdf,https://data.europarl.europa.eu/distribution/reds_iMaQp/E-9-2024-001186/E-9-2024-001186_en.docx,,,,,PE762.524,https://data.europarl.europa.eu/eli/dl/doc/E-9-2024-001186
E-9-2024-001234,Trans-Caspian transport corridor: EU measures to increase trade and strengthen European competitiveness,Trans-Caspian transport corridor: EU measures to increase trade and strengthen European competitiveness,Written question,9,2024-04-24,,Ondřej KOVAŘÍK,,English,https://data.europarl.europa.eu/distribution/reds_iMaQp/E-9-2024-001234/E-9-2024-001234_en.pdf,https://data.europarl.europa.eu/distribution/reds_iMaQp/E-9-2024-001234/E-9-2024-001234_en.docx,,,,,PE762.678,https://data.europarl.europa.eu/eli/dl/doc/E-9-2024-001234
E-9-2024-001241,Adoption of legislation to make it possible to bring pets into the workplace,Adoption of legislation to make it possible to bring pets into the workplace,Written question,9,2024-04-24,,Matteo GAZZINI,,English,https://data.europarl.europa.eu/distribution/reds_iMaQp/E-9-2024-001241/E-9-2024-001241_en.pdf,https://data.europarl.europa.eu/distribution/reds_iMaQp/E-9-2024-001241/E-9-2024-001241_en.docx,,,,,PE762.685,https://data.europarl.europa.eu/eli/dl/doc/E-9-2024-001241
E-9-2024-001266,Protecting fundamental rights in the age of AI: data and IP challenges,Protecting fundamental rights in the age of AI: data and IP challenges,Written question,9,2024-04-24,,Eva KAILI,,English,https://data.europarl.europa.eu/distribution/reds_iMaQp/E-9-2024-001266/E-9-2024-001266_en.pdf,https://data.europarl.europa.eu/distribution/reds_iMaQp/E-9-2024-001266/E-9-2024-001266_en.docx,,,,,PE734.717,https://data.europarl.europa.eu/eli/dl/doc/E-9-2024-001266
E-9-2024-001319,Impact of PFAS restrictions on the availability of medicinal products and medical devices,Impact of PFAS restrictions on the availability of medicinal products and medical devices,Written question,9,2024-04-25,,Pernille WEISS,,English,https://data.europarl.europa.eu/distribution/reds_iMaQp/E-9-2024-001319/E-9-2024-001319_en.pdf,https://data.europarl.europa.eu/distribution/reds_iMaQp/E-9-2024-001319/E-9-2024-001319_en.docx,,,,,PE762.724,https://data.europarl.europa.eu/eli/dl/doc/E-9-2024-001319
E-9-2024-001188,Language identification tool at Frontex,Language identification tool at Frontex,Written question,9,2024-04-22,,Cornelia ERNST,,English,https://data.europarl.europa.eu/distribution/reds_iMaQp/E-9-2024-001188/E-9-2024-001188_en.pdf,https://data.europarl.europa.eu/distribution/reds_iMaQp/E-9-2024-001188/E-9-2024-001188_en.docx,,,,,PE762.526,https://data.europarl.europa.eu/eli/dl/doc/E-9-2024-001188
E-9-2024-001316,Support for keepers of the European dark bee,Support for keepers of the European dark bee,Written question,9,2024-04-25,,Bronis ROPĖ,,English,https://data.europarl.europa.eu/distribution/reds_iMaQp/E-9-2024-001316/E-9-2024-001316_en.pdf,https://data.europarl.europa.eu/distribution/reds_iMaQp/E-9-2024-001316/E-9-2024-001316_en.docx,,,,,PE762.721,https://data.europarl.europa.eu/eli/dl/doc/E-9-2024-001316
E-9-2024-001246,Moldovan legislative initiative No 65 concerning postal voting,Moldovan legislative initiative No 65 concerning postal voting,Written question,9,2024-04-24,,Matteo GAZZINI,,English,https://data.europarl.europa.eu/distribution/reds_iMaQp/E-9-2024-001246/E-9-2024-001246_en.pdf,https://data.europarl.europa.eu/distribution/reds_iMaQp/E-9-2024-001246/E-9-2024-001246_en.docx,,,,,PE762.534,https://data.europarl.europa.eu/eli/dl/doc/E-9-2024-001246
E-9-2024-001273,Ukraine trans-European transport network inland waterway extension,Ukraine trans-European transport network inland waterway extension,Written question,9,2024-04-24,,Petras AUŠTREVIČIUS,,English,https://data.europarl.europa.eu/distribution/reds_iMaQp/E-9-2024-001273/E-9-2024-001273_en.pdf,https://data.europarl.europa.eu/distribution/reds_iMaQp/E-9-2024-001273/E-9-2024-001273_en.docx,,,,,PE734.724,https://data.europarl.europa.eu/eli/dl/doc/E-9-2024-001273
E-9-2024-001239,Bobsleigh track for the Winter Olympics in Cortina,Bobsleigh track for the Winter Olympics in Cortina,Written question,9,2024-04-24,,Maria Angela DANZÌ; Sabrina PIGNEDOLI; Mario FURORE; Tiziana BEGHIN,,English,https://data.europarl.europa.eu/distribution/reds_iMaQp/E-9-2024-001239/E-9-2024-001239_en.pdf,https://data.europarl.europa.eu/distribution/reds_iMaQp/E-9-2024-001239/E-9-2024-001239_en.docx,,,,,PE762.683,https://data.europarl.europa.eu/eli/dl/doc/E-9-2024-001239
E-9-2024-001252,Emmanuel Macron respecting the rule of law,Emmanuel Macron respecting the rule of law,Written question,9,2024-04-24,,Jean-Paul GARRAUD,,English,https://data.europarl.europa.eu/distribution/reds_iMaQp/E-9-2024-001252/E-9-2024-001252_en.pdf,https://data.europarl.europa.eu/distribution/reds_iMaQp/E-9-2024-001252/E-9-2024-001252_en.docx,,,,,PE762.226,https://data.europarl.europa.eu/eli/dl/doc/E-9-2024-001252
E-9-2024-001306,Invoking a ‘crisis’ situation to evade asylum law,Invoking a ‘crisis’ situation to evade asylum law,Written question,9,2024-04-25,,Sophia IN 'T VELD,,English,https://data.europarl.europa.eu/distribution/reds_iMaQp/E-9-2024-001306/E-9-2024-001306_en.pdf,https://data.europarl.europa.eu/distribution/reds_iMaQp/E-9-2024-001306/E-9-2024-001306_en.docx,,,,,PE762.711,https://data.europarl.europa.eu/eli/dl/doc/E-9-2024-001306
E-9-2024-001196,Ban by France of night trains to Barcelona,Ban by France of night trains to Barcelona,Written question,9,2024-04-23,,Antoni COMÍN I OLIVERES; Carles PUIGDEMONT I CASAMAJÓ,,English,https://data.europarl.europa.eu/distribution/reds_iMaQp/E-9-2024-001196/E-9-2024-001196_en.pdf,https://data.europarl.europa.eu/distribution/reds_iMaQp/E-9-2024-001196/E-9-2024-001196_en.docx,,,,,PE762.640,https://data.europarl.europa.eu/eli/dl/doc/E-9-2024-001196
E-9-2024-001307,Doubts as to the conformity with EU rules of Italian legislation on the transfer of ongoing businesses,Doubts as to the conformity with EU rules of Italian legislation on the transfer of ongoing businesses,Written question,9,2024-04-25,,Mario FURORE; Tiziana BEGHIN,,English,https://data.europarl.europa.eu/distribution/reds_iMaQp/E-9-2024-001307/E-9-2024-001307_en.pdf,https://data.europarl.europa.eu/distribution/reds_iMaQp/E-9-2024-001307/E-9-2024-001307_en.docx,,,,,PE762.712,https://data.europarl.europa.eu/eli/dl/doc/E-9-2024-001307
E-9-2024-001291,The way forward towards appointing a new EU small and medium-sized enterprise (SME) Envoy,The way forward towards appointing a new EU small and medium-sized enterprise (SME) Envoy,Written question,9,2024-04-25,,Michael KAUCH,,English,https://data.europarl.europa.eu/distribution/reds_iMaQp/E-9-2024-001291/E-9-2024-001291_en.pdf,https://data.europarl.europa.eu/distribution/reds_iMaQp/E-9-2024-001291/E-9-2024-001291_en.docx,,,,,PE762.696,https://data.europarl.europa.eu/eli/dl/doc/E-9-2024-001291
E-9-2024-001247,Survival of the European mink,Survival of the European mink,Written question,9,2024-04-24,,César LUENA,,English,https://data.europarl.europa.eu/distribution/reds_iMaQp/E-9-2024-001247/E-9-2024-001247_en.pdf,https://data.europarl.europa.eu/distribution/reds_iMaQp/E-9-2024-001247/E-9-2024-001247_en.docx,,,,,PE762.535,https://data.europarl.europa.eu/eli/dl/doc/E-9-2024-001247
E-9-2024-001238,Deposit and cross-border trade,Deposit and cross-border trade,Written question,9,2024-04-24,,Christel SCHALDEMOSE,,English,https://data.europarl.europa.eu/distribution/reds_iMaQp/E-9-2024-001238/E-9-2024-001238_en.pdf,https://data.europarl.europa.eu/distribution/reds_iMaQp/E-9-2024-001238/E-9-2024-001238_en.docx,,,,,PE762.682,https://data.europarl.europa.eu/eli/dl/doc/E-9-2024-001238
E-9-2024-001271,Addressing the ‘shadow pandemic’ of domestic violence,Addressing the ‘shadow pandemic’ of domestic violence,Written question,9,2024-04-24,,Eva KAILI,,English,https://data.europarl.europa.eu/distribution/reds_iMaQp/E-9-2024-001271/E-9-2024-001271_en.pdf,https://data.europarl.europa.eu/distribution/reds_iMaQp/E-9-2024-001271/E-9-2024-001271_en.docx,,,,,PE734.722,https://data.europarl.europa.eu/eli/dl/doc/E-9-2024-001271
E-9-2024-001314,"Bi-regional Pact for Care between Latin America, the Caribbean and the European Union","Bi-regional Pact for Care between Latin America, the Caribbean and the European Union",Written question,9,2024-04-25,,Mónica Silvana GONZÁLEZ,,English,https://data.europarl.europa.eu/distribution/reds_iMaQp/E-9-2024-001314/E-9-2024-001314_en.pdf,https://data.europarl.europa.eu/distribution/reds_iMaQp/E-9-2024-001314/E-9-2024-001314_en.docx,,,,,PE762.719,https://data.europarl.europa.eu/eli/dl/doc/E-9-2024-001314
E-9-2024-001225,Unacceptable practice in the use of the three official languages of Bosnia and Herzegovina on the website of the OSCE Mission to BiH,Unacceptable practice in the use of the three official languages of Bosnia and Herzegovina on the website of the OSCE Mission to BiH,Written question,9,2024-04-24,,Željana ZOVKO,,English,https://data.europarl.europa.eu/distribution/reds_iMaQp/E-9-2024-001225/E-9-2024-001225_en.pdf,https://data.europarl.europa.eu/distribution/reds_iMaQp/E-9-2024-001225/E-9-2024-001225_en.docx,,,,,PE762.669,https://data.europarl.europa.eu/eli/dl/doc/E-9-2024-001225
E-9-2024-001243,"Destruction by the local council of La Nucia, Alicante, of a species classed as endangered under EU law","Destruction by the local council of La Nucia, Alicante, of a species classed as endangered under EU law",Written question,9,2024-04-24,,Esther SANZ SELVA,,English,https://data.europarl.europa.eu/distribution/reds_iMaQp/E-9-2024-001243/E-9-2024-001243_en.pdf,https://data.europarl.europa.eu/distribution/reds_iMaQp/E-9-2024-001243/E-9-2024-001243_en.docx,,,,,PE762.687,https://data.europarl.europa.eu/eli/dl/doc/E-9-2024-001243
E-9-2024-001270,Research security: European cooperation and exchange with high-risk Chinese universities,Research security: European cooperation and exchange with high-risk Chinese universities,Written question,9,2024-04-24,,Bart GROOTHUIS,,English,https://data.europarl.europa.eu/distribution/reds_iMaQp/E-9-2024-001270/E-9-2024-001270_en.pdf,https://data.europarl.europa.eu/distribution/reds_iMaQp/E-9-2024-001270/E-9-2024-001270_en.docx,,,,,PE734.721,https://data.europarl.europa.eu/eli/dl/doc/E-9-2024-001270
E-9-2024-001172,Deterioration in the legal protection of the EU’s financial interests in Spain,Deterioration in the legal protection of the EU’s financial interests in Spain,Written question,9,2024-04-20,,Adrián VÁZQUEZ LÁZARA,,English,https://data.europarl.europa.eu/distribution/reds_iMaQp/E-9-2024-001172/E-9-2024-001172_en.pdf,https://data.europarl.europa.eu/distribution/reds_iMaQp/E-9-2024-001172/E-9-2024-001172_en.docx,,,,,PE762.510,https://data.europarl.europa.eu/eli/dl/doc/E-9-2024-001172
E-9-2024-001232,Scam websites,Scam websites,Written question,9,2024-04-24,,Maria SPYRAKI,,English,https://data.europarl.europa.eu/distribution/reds_iMaQp/E-9-2024-001232/E-9-2024-001232_en.pdf,https://data.europarl.europa.eu/distribution/reds_iMaQp/E-9-2024-001232/E-9-2024-001232_en.docx,,,,,PE762.676,https://data.europarl.europa.eu/eli/dl/doc/E-9-2024-001232
E-9-2024-001259,Attack on the environment in Andalusia: plan to discharge 80 billion litres of highly polluting waters into the River Guadalquivir,Attack on the environment in Andalusia: plan to discharge 80 billion litres of highly polluting waters into the River Guadalquivir,Written question,9,2024-04-24,,Manu PINEDA,,English,https://data.europarl.europa.eu/distribution/reds_iMaQp/E-9-2024-001259/E-9-2024-001259_en.pdf,https://data.europarl.europa.eu/distribution/reds_iMaQp/E-9-2024-001259/E-9-2024-001259_en.docx,,,,,PE760.124,https://data.europarl.europa.eu/eli/dl/doc/E-9-2024-001259
E-9-2024-001227,Eligibility criteria of the CREA-MEDIA-2021-TVONLINE programme and compliance with Regulation 2021/818,Eligibility criteria of the CREA-MEDIA-2021-TVONLINE programme and compliance with Regulation 2021/818,Written question,9,2024-04-24,,Ibán GARCÍA DEL BLANCO; Diana RIBA I GINER,,English,https://data.europarl.europa.eu/distribution/reds_iMaQp/E-9-2024-001227/E-9-2024-001227_en.pdf,https://data.europarl.europa.eu/distribution/reds_iMaQp/E-9-2024-001227/E-9-2024-001227_en.docx,,,,,PE762.671,https://data.europarl.europa.eu/eli/dl/doc/E-9-2024-001227
E-9-2024-001268,Discrimination against Galicia in the trans-European transport network,Discrimination against Galicia in the trans-European transport network,Written question,9,2024-04-24,,Ana MIRANDA,,English,https://data.europarl.europa.eu/distribution/reds_iMaQp/E-9-2024-001268/E-9-2024-001268_en.pdf,https://data.europarl.europa.eu/distribution/reds_iMaQp/E-9-2024-001268/E-9-2024-001268_en.docx,,,,,PE734.719,https://data.europarl.europa.eu/eli/dl/doc/E-9-2024-001268
E-9-2024-001311,Operation Wuambushu and migrants from mainland Africa,Operation Wuambushu and migrants from mainland Africa,Written question,9,2024-04-25,,Dominique BILDE,,English,https://data.europarl.europa.eu/distribution/reds_iMaQp/E-9-2024-001311/E-9-2024-001311_en.pdf,https://data.europarl.europa.eu/distribution/reds_iMaQp/E-9-2024-001311/E-9-2024-001311_en.docx,,,,,PE762.716,https://data.europarl.europa.eu/eli/dl/doc/E-9-2024-001311
E-9-2024-001303,Foreign relations and development cooperation with Burundi against the backdrop of the President of Burundi’s agitation against homosexuals,Foreign relations and development cooperation with Burundi against the backdrop of the President of Burundi’s agitation against homosexuals,Written question,9,2024-04-25,,Michael KAUCH,,English,https://data.europarl.europa.eu/distribution/reds_iMaQp/E-9-2024-001303/E-9-2024-001303_en.pdf,https://data.europarl.europa.eu/distribution/reds_iMaQp/E-9-2024-001303/E-9-2024-001303_en.docx,,,,,PE762.708,https://data.europarl.europa.eu/eli/dl/doc/E-9-2024-001303
E-9-2024-001222,‘Trade description’ in the production of natural mineral waters,‘Trade description’ in the production of natural mineral waters,Written question,9,2024-04-24,,Niclas HERBST,,English,https://data.europarl.europa.eu/distribution/reds_iMaQp/E-9-2024-001222/E-9-2024-001222_en.pdf,https://data.europarl.europa.eu/distribution/reds_iMaQp/E-9-2024-001222/E-9-2024-001222_en.docx,,,,,PE762.666,https://data.europarl.europa.eu/eli/dl/doc/E-9-2024-001222
E-9-2024-001199,Impact of nuclear tests in French Polynesia,Impact of nuclear tests in French Polynesia,Written question,9,2024-04-23,,Eric MINARDI; Annika BRUNA; Virginie JORON; Markus BUCHHEIT,,English,https://data.europarl.europa.eu/distribution/reds_iMaQp/E-9-2024-001199/E-9-2024-001199_en.pdf,https://data.europarl.europa.eu/distribution/reds_iMaQp/E-9-2024-001199/E-9-2024-001199_en.docx,,,,,PE762.643,https://data.europarl.europa.eu/eli/dl/doc/E-9-2024-001199
E-9-2024-001264,Repeal of Democratic Memory Laws in the Autonomous Communities of Aragon and Valencia,Repeal of Democratic Memory Laws in the Autonomous Communities of Aragon and Valencia,Written question,9,2024-04-24,,Antoni COMÍN I OLIVERES,,English,https://data.europarl.europa.eu/distribution/reds_iMaQp/E-9-2024-001264/E-9-2024-001264_en.pdf,https://data.europarl.europa.eu/distribution/reds_iMaQp/E-9-2024-001264/E-9-2024-001264_en.docx,,,,,PE760.319,https://data.europarl.europa.eu/eli/dl/doc/E-9-2024-001264
E-9-2024-001269,"No visas issued for the 16 Italian journalists heading on a reporting trip to cover ‘Prima Parthica’, a UN-NATO-EU operation in Iraq","No visas issued for the 16 Italian journalists heading on a reporting trip to cover ‘Prima Parthica’, a UN-NATO-EU operation in Iraq",Written question,9,2024-04-24,,Anna BONFRISCO,,English,https://data.europarl.europa.eu/distribution/reds_iMaQp/E-9-2024-001269/E-9-2024-001269_en.pdf,https://data.europarl.europa.eu/distribution/reds_iMaQp/E-9-2024-001269/E-9-2024-001269_en.docx,,,,,PE734.720,https://data.europarl.europa.eu/eli/dl/doc/E-9-2024-001269
E-9-2024-001194,European Commission’s purchase of 12 Canadairs with EU funds,European Commission’s purchase of 12 Canadairs with EU funds,Written question,9,2024-04-22,,Carlo FIDANZA,,English,https://data.europarl.europa.eu/distribution/reds_iMaQp/E-9-2024-001194/E-9-2024-001194_en.pdf,https://data.europarl.europa.eu/distribution/reds_iMaQp/E-9-2024-001194/E-9-2024-001194_en.docx,,,,,PE762.638,https://data.europarl.europa.eu/eli/dl/doc/E-9-2024-001194
E-9-2024-001277,Issues with the EIC artificial intelligence platform,Issues with the EIC artificial intelligence platform,Written question,9,2024-04-24,,Sabrina PIGNEDOLI; Francisco GUERREIRO; Tiziana BEGHIN,,English,https://data.europarl.europa.eu/distribution/reds_iMaQp/E-9-2024-001277/E-9-2024-001277_en.pdf,https://data.europarl.europa.eu/distribution/reds_iMaQp/E-9-2024-001277/E-9-2024-001277_en.docx,,,,,PE734.728,https://data.europarl.europa.eu/eli/dl/doc/E-9-2024-001277
E-9-2024-001220,Putting forward a legislative proposal to make motorcyclist safety barriers mandatory,Putting forward a legislative proposal to make motorcyclist safety barriers mandatory,Written question,9,2024-04-24,,Paolo BORCHIA,,English,https://data.europarl.europa.eu/distribution/reds_iMaQp/E-9-2024-001220/E-9-2024-001220_en.pdf,https://data.europarl.europa.eu/distribution/reds_iMaQp/E-9-2024-001220/E-9-2024-001220_en.docx,,,,,PE762.664,https://data.europarl.europa.eu/eli/dl/doc/E-9-2024-001220
E-9-2024-001274,Protecting Umbria’s forest trails,Protecting Umbria’s forest trails,Written question,9,2024-04-24,,Maria Angela DANZÌ; Sabrina PIGNEDOLI; Tiziana BEGHIN; Laura FERRARA,,English,https://data.europarl.europa.eu/distribution/reds_iMaQp/E-9-2024-001274/E-9-2024-001274_en.pdf,https://data.europarl.europa.eu/distribution/reds_iMaQp/E-9-2024-001274/E-9-2024-001274_en.docx,,,,,PE734.725,https://data.europarl.europa.eu/eli/dl/doc/E-9-2024-001274
